"",Document,Probability,Segment,emo_pos,emo_neg
323807,hey thank you for the reply i had to look up lizzie velasquez these are good questions and i dont know the answer personally the way i think about it is would i feel worthy if i was lizzie velasquez had down syndrome zach efron etc i can measure those people against my standard for myself and determine if i would feel worthy in their position now im not saying my standard is the right one but its the one i use for me not for others the interesting thing to me is that a lot of these people you mention while having some serious disadvantages hawking velasquez have done a lot of noteworthy things a more interesting question to me is is a serial killer worthy is someone who has done terrible things to others worthy,1.0,1,0.73,0.73
342746,first of all stop calling yourself evil now and i thought there was some reason behind you doing something like the evil type like someone cheating you misuse or something like that find the reason first and overcome it accordingly but you are not alone who faces something like this so relax it takes some time or some more time have a good day,1.0,1,3.13,0
401883,good people coming from places of real power are almost always givers they come from a place of surplus and wanting to share that with others around them dont feel bad instead protect women take care of your friends listen to them help your community be a good guy to be around,1.0,1,3.85,1.92
390596,are you good or are you just well behaved a good person self actualizes and seeks to live an honest life following their dreams a good person tells people the harsh truths some exceptions may apply you get the gist of it if your actions are truly your own and not out of fear of rejection than continue on but if youre a slave to fear then youre neither nice nor good,1.0,1,5.56,2.78
390441,if youre going to be a genuinely good person youve got to be careful who you are good to the liars cheats the selfish and proud the malicious the resentful the leeches all have to be avoided the benefits of being a good person are that you get to live with yourself knowing that youve made choices that abide by your beliefs of what a human should do be what you want to see in the world but only to those who wont take advantage of you,1.0,1,4.6,2.3
390396,well thats up to you but generally good people are picked up by the people they are good to building a community around yourself is important as people will help you when you are down if you help them when they are down if you want to be a bad person then thats fine but your circle will be small and filled with like minded people,1.0,1,3.03,1.52
388939,i recommend you read the book evil the science behind humanitys dark side by dr julia shaw i saw her speak live about this book and what youre proposing is the problem this society needs solving edit she wrote nietzches quote in one of the introductory pages he who fights with monsters should look to it that he himself does not become a monster,1.0,1,0,0
378179,i dont understand what you mean are you saying good people should understand that they wont be paid back equal to what they give other is that what yoy mean by accept an unjust life or are you saying people who consider themselves to be good will pridefully consider themselves above the law how do you deterine what is good how do you define what is evil,1.0,1,5.97,0
366750,i honestly dont think anything is the matter with you no one needs to know how you think or your thought patterns and tbh i get the feeling that you are most likely a really good person it would seem that the way you view being a good person is only going to make you a better person like whats the matter with constantly judging yourself against others and wanting to be a better and better person,1.0,1,2.6,0
363814,people thought of me as that girl and i also had the same problems you have at least some of them and i am absolutely not that person anymore the good isnt as good as it was but the bad also isnt that bad op should learn that people change through life and nothing stays the same,1.0,1,3.51,3.51
356703,i second this also bad things happen to good people every day you dont need to intentionally fuck around and find out how bad being honeless is because you no call no showed at work just to exercise your freedom to say fuck it youve put a lot of hard work into your life to start shitting on itjust to feel different you want to have a better life find productive uses of your time and dont do shit that hurts you good luck,1.0,1,2.38,3.57
348241,everyone likes to do whats easiest its much easier to be a bad person in every way when thinking about how we can do something bad several ways come to mind but to do good things usually not and when they do they are very complicated it needs to have a very strong motive a driving force she is the one who will make you dedicate yourself to the difficult things,1.0,1,1.41,2.82
344273,i would say you are not a bad person unless you purposely dont do good things and prefer to do bad things if you make mistakes while doing something it doesnt make you a bad person just keep trying to do better the next time since you are reaching out here it makes me feel like you dont want to be a bad person when you are going to do anything stop and think if it going to be good or bad always choose good choices while you are reaching out and trying to be a better person reach out to jesus he has all the right answers and can guide you to a better life he definitely did that for me,1.0,1,2.46,4.1
344002,what is your definition of a bad person i think im a bad person because i dont do enough productive things or have friends other commenter thinks youre trying to excuse being a dick to people how i deal with this is i try not to think about it i am not the arbiter of anyones worth myself included i can do good things and that isnt going to suddenly make it better if i rob somebody conversely the bad things i do dont negate the good things also change is inevitable it might not happen as much or as quickly as youd like but its always happening do you care about the same things year old you cared about no right you changed,1.0,1,1.61,2.42
342622,if you were evil you wouldnt see anything wrong with your behavior the fact that you realize what youre saying is hateful and wrong is proof that you arent bad your best bet is probably to find better friends so you dont need to say stuff you dont mean to fit in,1.0,1,0,3.85
251642,its okay to be good and trying to be good but realize youre human too and humans are not perfect also be careful not weaken your character i dont know what your exactly mean by always doing the right thing but often people who think they are good are just weak they always put others above themselves never say no always be nice to others etc,1.0,1,4.55,0
341707,depends on what being a bad guy means if by being bad you mean lying cheating stealing mooching etc then yes its really that bad if by being bad you mean living for yourself thinking for yourself producing for yourself and pursuing your own happiness then no its the opposite of bad its good its being selfless or what people sometimes mean by kind or nice thats bad,1.0,1,2.94,8.82
336909,you are a brave person you know that carritt in fact im rather impressed with what i read today from you not a lot of people have the balls and courage to admit they are terrible people and if you want my opinion realizing you are a bad person is one of the first steps to improving yourself i look around and i see people who justify bad actions drive cars like suicidal maniacs justify insults and bullying but not you at least you admit youve done wrong which in my opinion sets you far apart from the wretched people who think everything they do is correct pat yourself on the back carritt,1.0,1,0.88,4.42
332042,yes because you have an over inflated idea of what it means to be a good person a good person is someone who is capable of bad yet restrains themselves a pacifist is not a good person because they dont fight a trained fighter who turns the other cheek is a good person good people dont deluded themselves good people know their flaws so deeply they strive to be better despite them if youve failed the only test youve ever taken are you a good student,1.0,1,8.14,1.16
329175,i really appreciate that perspective so thank you but i cant help but feel that if i really was good like you say that id feel good but i dont really feel like a good person im constantly agonizing about my own morality and asking if i did the right thing but i dont know i imagine a good person wouldnt have to think this hard about if theyre good or not they would just know if that makes sense,1.0,1,7.5,1.25
304377,this is like a network and its cartoon you can tell what network is a good or bad network whether the cartoon is good or bad a good network has good cartoons and a bad network has bad cartoons what is produced is by what network its coming from good minds produce good cartoons and the same is with action good actions come from good hearts a parent wouldnt look to give their kid food and water a place you sleep and a school to learn but to value their kid more than they to love so that their eyes are turned to the needs and they will get fulfilled because they are valued one is a burden and one is an expression,1.0,1,7.32,3.25
298692,there is no such thing as a bad person everyone is just a product of their own environment as far as improving as a person after raping someone you can pretty much only become a better person from here take things one day at a time and dont let that keep you from chasing your dreams,1.0,1,0,1.79
290263,i guarantee your issue is your personality i agree youre probably not a good person i disagree its possible to have good intentions but for whatever reason s the impact doesnt match intent so in either case yes until you improve yourself your life is gonna suck and also its possible to realize that you were kind of an asshole but you choose to change your thoughts and actions become your ideas and habits and that ultimately can and does affect your personality after a length of time but its painful as birth which makes sense because youre kind of re birthing yourself,1.0,1,1.94,0.97
285114,youre not a bad person it is good to spend a few minutes throughout the day to reflect on what you appreciate about people you come in contact with its sort of hard at first for some people but over time it will be easier if you stick with it you will have a more positive bias towards people,1.0,1,3.39,1.69
276955,this post has reaffirmed that good people do exist i had lost all hope and faith because the way the people treated me for following ethical path honesty and trusting other people for their word it resulted in jealousy back stabbing and deceitful attitude but i will continue on the path i am on thanks for this post,1.0,1,3.45,1.72
272864,you mention that many people go far by being manipulators while that may be the case the chances of living a good life are far better if youre genuinely a good person you second point was about business again as someone who studies entrepreneurship and who has a bit of experience in that field as well i can tell you that being good goes a long way im not saying that you should be weak and be someone with no backbone not at all being strong and understanding evil are important theres a reason ive read the laws of power and try to be careful and vigilant around people there are a lot of shitty people in the world however my point stands that being a genuinely good person is good advice and will get you further in life in most cases at least in todays western society if you are good as you say understanding evil is important because it allows you to stay smart i dont disagree with this everything is nuance being good is great as a default state but being flexible and prepared for the worst case scenarios are also important whats wrong with me saying that we should be kind i think youre taking my words as an extreme just because i say be kind doesnt mean im saying be kind all the time to everyone circumstances are unique and you will need to be able to adapt to situations whats the book youre referring to about the soul needing to be neutral im curious,1.0,1,2.69,0
264229,you admit you are the problem and i like how you acknowledging that you want to do better next time for your sake for others and now you are distinguishing right wrongs you wanting to share this i see that you just showed me a human side of yourself right there no you are not a bad person or not human at all like you think you are,1.0,1,0,1.47
259856,there are no bad ones because there arent any im years old i still live with my parents im obese and i havent had any kind of relationship since i was the world isnt going to allow anything all i can do is work to improve my situation with the hope that ill improve my luck someday but its not like im going all in on the hope that itll actually make a difference,1.0,1,2.7,1.35
405946,wtf even is a bad person i mean really there is nothing that is wholly good or bad everyone i mean every single human makes mistakes and has traits they do not like about themselves these are part of what makes us human not accepting that you will make mistakes is to argue against being something other than human,1.0,1,1.69,5.08
409542,admitting how much i make excuses and get in my own way learning to catch myself in the moment before choosing harmful words or actions realizing that people will be people no ones perfect including me people will make mistakes and hurt each other but that doesnt mean they are a terrible person,1.0,1,0,3.77
413873,bad ppl are the ones who dont feel remorse or guilt or even try to take accountability for the things theyve done every grown person can go on about all the things theyve done we all do stupid shit some that weve picked up from our environment to blame and others that we just did on our own but you arent a bad person just making bad decisions coping with things the wrong way,1.0,1,0,6.76
415331,i think about that almost every day latelly found out the answer in a meme i saw this month good people sleeps well thinking everything is all right bad people sleeps knowing what is wrong and i complete this meme with my cents assertive people sleeps confortably knowing how to defeat the bad ones while keeping the good ones as friends,1.0,1,3.28,3.28
496866,the world is evil because evil is the essence of our nature everytime we have power we abuse it everytime we do something right we boast about it but everytime we are wrong we forget about it we are naturally lazy we are naturally violent we are selfish we are conquerors it is simply part of our nature not because there is not enough good people,1.0,1,1.52,1.52
496698,there are a lot of perfectly good people raised in a terribly problematic world theres no baseline of goodness because everyone is just busy trying to survive as long as greed and selfishness exist people will always struggle and often lose themselves were flawed and easily broken even the best of people can become monsters in a world like this one its sad,1.0,1,1.59,3.17
496676,i have a particular view of this i think that today evil is winning mainly due to the relativization of evil and good many opinions and few facts i dont think most of it is relative i think there is reality and there is what people think learning to see reality as it is and not affect it with your thoughts its something most people should learn since childhood,1.0,1,1.45,0
496675,i agree i guess i didnt word that very clearly lol evil exists just because you choose to view the world in a positive way doesnt mean evil or negative things arent happening im saying the world is a good place for the most part but if we turn on the news atleast in my country you would think the world is burning because negativity and fear and evil sells,1.0,1,1.43,1.43
496672,this is easy to define people use this question to show that evil depends on ones point of view when in fact thats not how reality works evil is nothing more than something that results in a bad long term future lets take hitler one of the most famous names as an example suppose we go back to the past when hitler was just a child would it be good to kill him so that he doesnt kill thousands in the future that would lead to a better long term future right wrong lets analyze the possibilities killing him means putting values of a good society as a variable since we could commit murders if the murdered person is bad we would create a future bathed in blood the second point is if we killed hitler he wouldnt serve as an example of how harmful a bad person who comes to power can be this would lead to a low social awareness that would lead to another bad person coming to power and committing atrocities again so hitler coming to power is a necessary evil because it makes people see how much is bad allowing this to prevent this from happening good people must create a system that prevents people like that from winning so we see that bad is what creates a bad long term society,1.0,1,1.32,3.08
496670,i understand that but how do you explain the majority of society that gets along with each other if evil was of the worlds feelings then we all would be committing crime and trying to destroy each other to say the world is good or bad is perception in reality the world is nebulous neither good nor bad and thats proven in your example of good to evil during birth,1.0,1,4.29,2.86
496667,lets analyze in reality people are born inherently good after all what kind of person would want to cause harm to make the world in which they live worse and this can also be analyzed metaphorically making a parallel with reality if light is the representation of goodness as it generates life darkness would be the representation of evil as it generates death if people are born it means that godness already has an inherent advantage what happens is the confusion of good with bad evil people try to justify their actions covering their faces for the truth and denying responsibility the world becomes bad when there are many bad people living in it but no matter how many bad people there are good will always be present and will be the only way to progress in bad there is no progress so we conclude that the world is only bad because there are not enough good people people become bad because they end up accepting evil as truth in their lives so every decision made is towards him to the point that good ends up becoming a childish naive illusion for example telling a harmless lie thinking it will lead to a better result when in fact only the truth can lead to the better inherent result,1.0,1,2.29,3.67
495588,written by saint kabir das i searched for the crooked met not a single one when searched myself i found the crooked one translation i went on the search for the bad guy bad guy i couldnt find when i searched my mind non one is nastier then me meaning this doha is about observing ones own mind kabir says that he searched the world for the bad guy the real evil person but he couldnt find the evil person no matter where he looked then he looked within at his own thinking process his own mind the he found the real evil person who lived in his mind unchecked when we accuse condemn another it is our mind that is doing the finger pointing the other person is probably innocent or the victim of his circumstances were we to inhabit the condemned persons body live his life have his conditioning then we too would behave and act the same,1.0,1,0,1.88
485116,i wish good to good people wishing good to bad people is currently out of my ability and moral viewpoint maybe i would add taking care of your health and well being as for that might depend on who you ask someone you just had an online argument with wont say the same as someone who cares for you,1.0,1,8.47,3.39
472265,your subjective world view doesnt create statistics of which you mentioned but i do understand that world is not a perfect place bad things happen all the time but still doesnt mean there is no good in it the world is not black and white even if it seems like it there is around billion humans and everyone has a perspective a window to look at all different stories filled with good and the bad,1.0,1,2.67,2.67
470528,if you ever wonder why bad things happen to good people its because god knows theyre capable of handling it dont worry my friend you will survive and thrive throught this with time my practical recommendation that i sincerely believe will help you is to develop yourself iternally to become a man of abundance in your inner world remake your life find your new objective in life that you have capability to achieve think about your life in a new perspective and with new light in your heart with hope and passion for something that make you alive even if you are in pain hope that helps stay strong and never give up,1.0,1,2.65,2.65
466450,i dont think im evil because i have done any harm to others or myself i think the sexual desire and attraction to the opposite gender i e women is evil now i cant exactly get rid of that completely can i the best i can do is bury it deep inside and make sure it doesnt try to get out back again,1.0,1,0,0
456867,people are only as moral as their actions people are born blank slates their choices determine their moral worth this is the thing you arent getting you you personally were born with the potential to become a jesus christ or a buddha ultimate moral good but you were also born with the potential to become a ted bundy or a hitler ultimate moral evil you still have that potential to this very day you could wake up tomorrow and decide to give all your wealth to a charity or you could wake up tomorrow and decide to do a horrible act you still have that ultimate potential you were born with just as everyone does as you grow older your runway is limited but potential is always infinite the fallacy most people fall into is to believe themselves incapable of evil people like to say i could never do what hitler did i could never do what ted bundy did i am incapable of that level of evil people say this to reassure themselves that they are good and others are evil but the truth is we all have that potential for evil within ourselves no one can ever truly say i am not capable of evil everyone is capable of ultimate good or evil to say you are not capable of evil also limits your perceived potential for good potential is omnidirectional and ultimate by nature,1.0,1,1.69,0
455034,the world is deeper than surface level if you believe in the battle of good vs evil it sounds like you were just put on the battlefield you chose the good side this happens everyday sometimes the choice is small sometimes its blatantly gross and evil be vigilant and stay strong you are a pure person of light dont ever let anyone or anything tell you otherwise,1.0,1,2.99,0
454029,i understand youre trying to find the most extreme examples possible to try to get me to say there are bad people but it just doesnt work like that there is logic in my theory and im not sure why it upsets you so much youre welcome to disagree with the theory its not that big of a deal,1.0,1,0,3.39
454021,so that isis leader that my unit spent months and lost men chasing down who would torture children rape woman commit massive genocide in ways that would make you piss your pants is just a person that decided to do bad things however he could have decided to change his ways and plant flowers for the rest of his life in some random country help neighbors help grandma at the grocery store but he wouldnt be considered a bad person there is no logic in your theory i honestly dont think you have seen true evil,1.0,1,0,3.13
453723,hitler wasnt born evil hitler was born with ultimate potential for either good or evil just like of the rest of us he made a series of choices which ultimately led evil choices and to horrific consequences his actions were evil perhaps he himself came to embody evil but he as a human cant inherently be evil every single human born into this world has the potential to become a hitler or to become a buddha we all have infinite potential in either direction the most dangerous thing you can convince yourself of is i am not capable of doing evil things we are all capable step by step micro decision by micro decision if you believe you simply dont have the potential or capacity to do evil things you are statistically more likely to end up doing evil things bc you can gradually and progressively justify your choices until you find yourself doing evil things if you think you arent capable of darkness you are more susceptible darkness will sneak up on you better defense only real defense against your darker nature is to come to know and understand your shadow self get uncomfortably familiar with what your shadow might be capable of given context and rationalization only this way can you identify pathways which will lead you to bad places and avoid even the appearance of evil by knowing that you hold ultimate potential within yourself and you consciously choose to do right action knowing you could if you wanted to choose anything else,1.0,1,0.39,1.17
441200,strengthen the good ones against the bad ones dont take it out on the good ones or the bad ones will grow and multiply and by bad i mean non consent type of bad and not the motorcycle sunglasses leather jacket kinda bad righteous men those who do that thing right despise wicked men and will usually even shoot them on sight if they can get away with it,1.0,1,2.9,8.7
