"",Document,Probability,Segment,emo_pos,emo_neg
294697,strive to be a villain not a hero villains are more effective they are unstoppable and dont care about anyones opinion they prioritise themselves first and no matter how selfish this sounds its healthier than burning yourself to warm up others that doesnt mean you should bully and abuse others or deceive and manipulate to get what you want its about lifting the weight of pressure to be good person off your shoulders hero like mentality which we learn from media and society is limiting because it makes us feel like we are selfish not good enough and that we dont deserve things we want you can be a villain but still a good person especially that there are many actual evil people out there who will make themselves a victim and try to use your kindness for their advantage and whats worse they are the ones on the winners side once you get this mindset you realise how many people friends relatives do not have your best interest at heart deep down lots of people compete with you because they feel insecure or they just dont want you to do better than them when you start showing up for yourself and stop being a people pleasing hero they will start to demonise you you will be labelled as villain because you dont let anyone benefit from you anymore okay then they are right who cares just do your thing anyway you can lose your life to self sacrifice self hatred and self doubt the world doesnt want you to love yourself other people dont want you to love yourself because when you do they cant profit off you and you become a threat dont let them stop you i found this concept on villainmindset on tik tok this advice completely changed the way i see things and it made me much more immune to bullshit and manipulation,0.8972217741159962,1,1.89,0.94
454211,alot of countries during called that generation the greatest generation who fought with the allies however again you are wrong as usual with no facts just assumptions one day you will grow up maybe see the world i dont know or just sit in mommies basement quoting theories from psychologists on theres not such thing as a bad person,0.8948536979359154,1,0,1.69
491250,just gotta comprehend that this world is highly flawed and nearly everyone except the enlightened masters are pretty incompetent and even then they are facing just how the world works naturally in an imperfect world we must comprehend that clearly and be better but if someone is arrogantly causing you suffering then by all means unleash the fury,0.8900122494597384,1,0,3.45
316985,evil exists if you are good you will be at a disadvantage the aim of power glory and survival justify the use of immoral means any man who tries to be good all the time is bound to come to ruin among the great number who are not good hence a prince who wants to keep his authority must learn how not to be good and use that knowledge or refrain from using it as necessity requires the prince niccol machiavelli ive adopted a character which robert greene refers to as aggressive sophisticated in a nutshell i will do anything it takes to fulfill my purpose even if its at the expense of others to me they dont matter only my purpose does and i believe that it will make the world better so it wants me to succeed,0.8891019786950943,1,2.88,0.72
291905,history has a way of repeating itself as well as their thought process and judgement in circumstances can give you a since of their maturity level to guage potential reproductive qualities that and in society reputation has continued to be important for alot of quality of life benefits so being with the town drunk or the city bicycle tends to be a kick in the nuts people change im not saying anyone should be judged on their past merits but whom they became following those struggles i sure as hell hope someone wont judge me for mine so i will try and not do it to them dont let wanting to know someone completely from a love perspective cause you to believe knowing everyone they have been with or every stupid choice they have made as a good thing or fair to either party when someone makes you happy today dont go find something to dislike from the past edit small typo,0.8890283264625711,1,2.47,0.62
46781,when you think something bad about someone you are like cursing them unknowingly and making thier luck fall this thing is the same about what other people think about you so be nice to every person and your luck will be amazing if you can you should call people that are angry at you for things you done in the past and try to solve it and once they will stop thinking bad stuff about you thier secret curse on you will stop edited this is something in judaism called ain arah you can choose to not believe this but it is true non the less,0.8868317189654612,1,0.94,2.83
445078,im not saying that people dont suck litterally every single human being on this planet sucks one way or another i think the thing is finding and surrounding yourself with people who suck in ways that you dont mind also those are some really heavy categories you mention a lot of people are neither of all those things and if all youre seeing is those kind of people you should probably try to surround yourself with other people,0.8835936034029834,1,0,0
436032,yea one think i realize is the world thrives off suffering and pain in nature its about brutality of being hunted dying by starvation or infection in the human world the first world thrives off the suffering and exploitation of the third world amazing technology infrastructure so cheap because the people who help build it get paid pennies scary thing to realize makes me question if its god or satan running this show evil wins because they dont abide by the rules of morality theres a show called ozark good show wont spill too much but by the end you can see how they become demons and lose their souls,0.8817373407401277,1,1.82,3.64
496664,well things perspective is everything theres plenty of good in the world it just doesnt get advertised regardless of all the bad that is currently happening by and large this is the best time in recorded human history to be alive but to someone in a current war torn country they definitely wouldnt have that same perspective secondly i truly believe that since we come from ancestors that were running away from other animals species that could kill us we will always react more to bad dangerous things even in my own life i remember more of bad things that happened to me as a child than good so we tend to focus on bad people than the people who volunteer the people who donate their time money clothes to those in need the people who join the peace corps religious leaders who are trying to do good in their community teachers and anyone else making a small difference simply because theyre good people,0.881424632513938,1,2.44,2.44
8244,i dont know if it is relevant to this subreddit but i want to confess something today a person im very close to and whome i love told me that i see evil everywhere ive been thinking and thinking again about what this person said and it might be true it is due to many things including my education and my way of thinking but this trait is causing a lot of difficulties to me,0.8770259254952149,1,1.33,0
344176,its never about being a bad person or good person its about trying if you are trying your best or less than best then that alone makes you better than percent of others in this world and its not easy to always keep trying to be good cuz the world isnt fair but guess what you still gotta do it for your own sanity being good to others for selfish psychological needs is the easiest way to convince yourself to treat others better than what they have been treating you peace,0.8756681528794641,1,3.3,1.1
318368,there are sociopaths and psychopaths yes we dont know how to treat those conditions yet or how to prevent them or what causes them this is getting into philosophical territory here and im not really interested in discussing that in depth right now but no i dont believe there are people who are born bad i believe there are conditions we dont yet understand,0.8637840947309045,1,0,1.56
17660,whenever i try to do something good i feel like im using it to cover up the bad inside me which i know to be truly me i think i am a bad person how do i stop feeling that way if im jnherently bad is my only hope accepting that and not trying to do anything good,0.8619089780058752,1,5.17,5.17
371564,because i am confident that my morals are a good grounding for what it means to be a fair responsible genuine person and active member of society in other words i feel like im lying to myself im trying to do selfless acts which dont align with my thoughts on occasion,0.8602948136058386,1,3.92,0
265688,i mean what if you feel like youre not good enough because your entire life has been people treating you as though youre not sure you may be able to trick yourself into believing that you are but where are you supposed to find people who agree where am i going to find the person who also thinks im good enough,0.8580696533967874,1,3.28,0
30213,i like to think that im a good human being i mean i dont kill people and i dont do drugs so i must be on fleek when i saw my little sister choosing the worst boyfriend i tried to convince her had a ton of arguments with her because i am dead sure that he is of a bad influence for her also i know i am right cause i want the best for her and because i love her then it hit me when i thought that if there are chances of me being wrong him being good then what are the chances of me actually not being a good person what if im just blinded by my own perception about myself that knocked me down real hard,0.8572260701740628,1,3.08,1.54
461742,yes some people are just evil it was a new coworker that was talking behind all peoples back and was passive aggressive all the time there was tension in the air when this guy was around and he never ever shut the fuck up anyway his life is a completely mess and a masquerade then i understand where his anger is coming from and it has nothing to do with me because i didnt do anything wrong to him thats life i guess,0.8545207247533964,1,0,3.61
434279,i have felt this way since i was when my mom took her own life and my family shattered but wealthy i grew up evil but if im honest i have a glass heart i had no problems acting like an adult even at that age ive shocked the world around me that the little girl who clearly had it all thought out was just a front a lie so magnificently orchestrated that the world and the main character lived in fantasy land until it broke ive always made it known to not fuck with me im the villain in every story the story of the hero and the villain isnt black and white good people do bad things and bad people do good things karma wont get you my dear cause youre not the one that is putting the negative out there giving the assailant a mirror isnt wrong itd be wrong for you to accept the negativity and let it rot you inside or outside feeling good as long as youre not the one instigating the conflict in my books is all that fucking matters in life,0.8480286469086816,1,1.59,1.06
274960,thats a wall of text i wasnt prepared for im not talking in spiritual terms i am talking realistically and obviously me saying that doesnt exclude being grateful or mean that youre attaching in fact its exactly that seeing people as they are makes you not attached to their potential just because you think what is best could differ from other person from my experience when we see the best in people we start having expectations of how they will behave not realisitc also they feel we have too much high standards for them could be or they themselves have very low standards for themselves as a person and their approach to life its subjective your definition of best could be someone elses unreachable hence see people as they are allows you to really know them and detach from anything else just let people be that is something we agree on i think you read way too much into what was not said,0.8418185019299345,1,0.61,0
373639,bad things actually happened i hope its okay for me to ask but what do you mean with bad things in this case sometimes we only think things are bad because we care too much about them for example when someone talks behind our backs and we overhear it we might think thats bad but thats exactly the kind of situation where we need to learn to care less we cant get everyone to like us no matter how much we try some people agree with you some people dont some people are nice to you some people are rude,0.8410675565416501,1,1,5
499941,prioritize the truth while horrible people do exist there is also no horrible person how is that possible horrible is a matter of human perspective does an ant think youre horrible does a tree think youre horrible does the moon do what you need to but if you must care about what others think just realize so many human perspectives can be delusional even when agreed upon in mass unison,0.8402131467926282,1,0,0
192097,when you have people in your life that dont contribute to your happiness and only make you feel worse you cut them out of your life its good that youre trying to be understanding its definitely a good thing but you need to know when a person isnt good to have around anymore also i had the problem that you had about being a good person i am a good person but i just wasnt as good as i wanted to be which was unrealistically good keep in mind you will always have negativity and darkness in you but it doesnt define who you are dont have too high expectations good people are never good of the time i dont know you though maybe your goals are realistic in that case i would say remember to take babysteps it takes time to improve and change it is a challenge but a challenge worth winning,0.8381286107376112,1,6.49,0
135402,i used to have this attitude but i dont as ive gotten older there are evil people in the world there are people who have embraced their weakness and their malice whilst they may not have intended to end up that way they are still doing evil those who do evil should be called up for it my suggestion would be to not speak about anyone without careful consideration of the words youre using and the factual basis of your opinion,0.8335833042527874,1,0,1.23
233045,be careful here the meaning of life and the meaning of good and bad belong to no one but you good and bad are discussed in many religions and the analogy of the tree of good and evil is actually about judging everything as good or evil when in fact they dont need your judgment calling people or acts good or bad is how people shame or pressure each other certainly hurting those weaker that you is bad but there are gray areas you need to ask yourself what is good or bad and if you have the right to make those choices if you are worthy of the power of choice i love the quote i will not sacrifice others or sacrifice myself i matter and you matter and we should try to make every negotiation a win win scenario,0.8250972503734455,1,4.96,4.96
386854,getting people presents doesnt equal good person you can be shitty and buy presents if this is something you want to change about yourself find ways to show the people in your life how much you appreciate them with simple gestures like cleaning their car or offering to take them out to eat or simply telling them you love them and be genuine own up to the ways you can be better but dont beat yourself up because it wont do you any good,0.8208344429514824,1,4.76,0
153938,i did this find the shitty person in yourself we all have one and love it usually when we hate something in someone its because we hate it in ourselves understanding is to me a more genuine path to having empathy for others it doesnt mean you have to be chummy with everyone lol but this for me at least greatly released my hatred of humanity eventually now i am at a point where yes i could see the evil in all beings but now i am starting to genuinely see the good no one has to do that and i dont think it needs to be forced but sometimes bad people had really really bad lives theyve never had he luxury of someone seeing the good in them its a little gift we can give them in an incredibly harsh world for them,0.8164636597085416,1,2.08,3.47
52100,for a long time ive held the belief that all people are inherently good people or at least neutral people who then make either good or bad choices based on the things theyve experienced in the past that its the actions that are good or bad and not the people but at the same time ive also been telling myself over and over that im evil that im evil at the core and that whenever i make a mistake its proof that im bad now im realizing that that doesnt make sense at all how can i say one thing about everyone else and the complete opposite about myself i am a human just like all the other humans on this earth im deciding now that i wont think of myself as evil anymore i will still acknowledge when i make mistakes but i will no longer punish myself or be mean to myself like i have before not anymore i am good for the most part i think i am doing my best to be kind to others the world is a better place with me in it because i contribute with my unique perspective just like everyone else does and if i want to be kind and see the good in other people i have to do the same for myself too because doing anything else just doesnt make sense,0.8091205527420933,1,2.16,1.29
449011,im not saying people dont have the capacity to be horrible but if its something you encounter often then theres possibly something else going on really bad luck or in a place that attracts or breeds assholes where i live you dont act like that very long before someone rocks your world,0.8087818258471916,1,0,1.92
145542,your predicament is in need of a superhero you are your own superhero speaking to truth cuts through peoples ego family and stranger alike if theyre being mean call them out on it be cordial but firm you are the master of your life within the context of what the earth and your surroundings offer vulnerability is something we hide behind our egos be open and honest and youll see your vulnerability disappear you are who you are love yourself treat people with kindness and when needed command it from them through action i grew close to my mother through this process leave any dishonesty behind you and the world will reward you,0.8065256351952713,1,1.77,0
230572,my friend you sound like someone who is huffing on a bit too much of their own gas dont be so over dramatic you sound like a deluded anime character in the middle of their angsty monologue there are plenty of good people in the world there are plenty of bad people too realistically though most arent out to get you and its just confirmation bias fucking with you,0.8045503825188006,1,1.45,2.9
450619,imo most people are shitty to varying degrees not actively mind you but are small minded the outliers are good people a few people are outright intentionally garbage but the majority arent good human nature is inherently selfish it takes an outlier to go against the grain now im not saying small minded selfish people arent fun or bad to be around but theyre not good people either,0.8044954196449214,1,5.88,1.47
401947,thats very convenient to think if youve done something bad that way you never have to admit that youre a bad person and can do just about whatever you want and then forgive yourself afterwards no suffering involved with the evil you produce however in my experience with being a human and interacting with other humans people dont tend to change their shitty behaviour on a fundamental level until they suffer for it they can put on a facade of being good for a while that is until they experience more extreme circumstances and their actions are based purely on emotional responses at that point no amount of logically thinking yourself into being a good person will make you one when people seriously suffer for their bad behaviour and i mean seriously suffer so much so that they want to die litterally want to die that is when the change of them becoming a good person is imprinted on the mose base level of their character everytime they become emotional enough to normally revert to their bad behaviour they remember the pain their actions caused them the last time and youll see their face change from anger to a much more mellow look before they are able to act it out this only works if you have empathy of course and are able to suffer when your do something bad hence the comparison to psychopathy,0.8043605387229323,1,1.28,5.11
395696,one thing ive noticed lately is that people in general are only looking out for themselves its a general statement because of course there are so many wonderful selfless kind people in this world but just going about the world and interacting with people i see how so many just quite simply dont give a f anymore about the greater good improving their community and realizing that the world is not theirs but that we live in shared space they budge in line intentionally they get mad when small things dont go their way theres this got mine eff you attitude people in general have such a selfish attitude its really disheartening to see and i feel like pre it wasnt as bad as it is now,0.8013905990878537,1,1.57,2.36
321200,be the reason someone believes in good people kindness takes a lot of strength and i dont think that kind people are appreciated enough i used to have a similar reaction as you previously did when people would refer to me as nice now i take that as such a great thing to be known for ive struggled with depression myself and having just one interaction with a kind person whether its brief or not made my day a little bit brighter if theres people as kind and you and i then theres bound to be so many others im happy that this shift in kindness became more appreciated on your end and this post warmed my heart it feels nice knowing that someone else out there cares enough to be kind to someone and put a smile on their face i hope that you continue to feel the spark that brought you to share this and i wish you the best in whatever you do the fact that you feel joy in making someones day better just shows how amazing you are thank you for all you do and i appreciate people like you,0.8005775439932487,1,4.62,0.51
