"",Document,Probability,Segment,emo_pos,emo_neg
32376,youre not a bad person youre a very good person who bad things that happened to the world isnt split into good people and bad people everyone on this planet has got both light and dark inside of them whats important is we choose to act on thats who we really are a good person can still encounter defeats and failures so if youre down dont blame yourself you are going to encounter defeats but it must not defeat you encounter the defeat but doing that youll have a greater knowledge and idea of who you truly are what you can rise from and how you can still come out of it with a massive smile on your face being a good person isnt going to chance your luck it isnt going to change the way other think about you but its going to prove to yourself who you truly are when youre down and out continue to be that person dont change in this day and age youre one of very few people on this planet that can be considered a good person carry that with you and never drop it youre a good person that has had terrible luck but dont let this bad luck overshadow you as a person youre a good person with a terrific heart dont change for anyone youre doing the best you can,1.0,1,3.91,2.17
246313,being bad is not something that you are because of what youve done being bad is what you are when you continue choosing to do bad things whatever youve done in the past you can choose to try to make amends or you can choose to be a positive influence on the people around you,1.0,1,0,5.45
40674,when i mean bad people i am referring to those that have no moral compass and show no remorse for their actions its not even just people who comit crimes like murder or theft but also those that are still within the law for example backstabbers that will sabotage anothers career for their own gain or people who continue to cheat on their partners i know multiple reasons why people do these actions but it still makes me uneasy knowing they are out there i find it pretty common too from what i have experienced or seen myself i am also aware there are plenty of good people in the world too i guess part of the problem is i dont feel safe around most people anymore,1.0,1,0.79,2.36
17855,ive never felt like a good person i used to make horrible choices i spent time in prison and laid waste to most relationships in my early life ive since made some big changes and feel like i make mostly good choices but i still dont feel good anyone else like this,1.0,1,5.77,0
453742,hitler was just a person like you or i who did many horrendous things but hitler was not born with evil in veins he chose to do evil things op believes he is a bad person and that line of thought leads to people easily justifying bad actions because its the nature of bad people to do bad things the point im trying to make is that no mater how many bad things you have done you can choose to do good things with the rest of your life because there is no such thing as an inherently bad person we are not slaves to our nature we choose how we live our lives every day sure there are actions that are unforgivable murder rape etc but the worst thing you can do is let those actions define you and your actions moving forward because they make you a bad person,0.9964603625971827,1,0.66,4.64
480452,and so what id rather destroy everyone else and live a full and fulfilling life without regrets and remorse than living in a society and feeling constantly inadequate and being tortured by past mistakes whats the point in being a good person if you live a shitty life in short better be happy than good,0.9923877850715749,1,5.45,5.45
390411,theres no logical reason to be good just as there is no logical reason to be bad why subjectivity of ethics and morality we all have different definitions of this meaning of life subjective and personal part of selfhelp is to encourage people to find their meaning to some their meaning is selflessness and helping others to others their meaning is to do what is best for only them why be a good person because it makes you feel better,0.9820399262616334,1,2.5,1.25
455073,you dont like bad people but not wanting to help certain victims because of their personality makes you a terrible person good and bad are arbitrary concepts that cannot be decided by you alone nor can they be used to determine who gets help and who doesnt a victim is a victim,0.9742067937419792,1,1.92,5.77
412970,think about it this way if someone has cancer right now is their body unhealthy yes but if someone had cancer before but its now gone are they still unhealthy not anymore similarly you may have been a bad person when you were doing bad things but now that youre no longer making those same mistakes youre not a bad person anymore,0.9733952011200885,1,0,4.84
400936,everyone has the potential to be a selfish prick everyone you your mother your father your teachers your peers your bosses your coworkers your doctors your emts your heroes your religious peoples your friendsall of them can be evil and will be if it benefits them they will all betray you the moment shit hits the fan live life knowing that the cup you fill is bottomless as much evil as you put in it takes only a pinch of good to start down on the path to reverse all of that evil it is never too late those who say it is have defeated themselves in their own minds everyone lies everyone is allowed to lie manipulation is not evil but a neutral action learn how to cook pasta al dente properly live like death is sitting on your shoulder freedom is the most valuable thing in the world it cannot truly be bought for no one can afford it a day off from work cannot be measured in worth,0.9731535673808261,1,0.58,0
446477,from what you wrote i dont see how anything you did makes you a bad person i think you are being too hard on yourself and putting too much pressure on yourself to be an ideal person an ideal thats not really realistic because we are all kind of messed up and we all have issues bottom line there are no perfect people and yes there are bad people but you dont seem to be one of them,0.9726352294734736,1,0,2.56
258357,and if you work an office job in the city youre directly perpetuating all kinds of evil shit too but somehow people can be like im just in the mail room i hate this company too all while theyre working to process all the mail that evil inc is using to rob people most people are cogs in some kind of machine which machine are you helping i mean if you live in an air conditioned apartment youre destroying the world if you ate a fucking chicken nugget today you helped kill an animal if you had a can of green beans youre responsible for deforestation,0.9723160618346222,1,0,0.94
92091,there are three types of people in this world sheep wolves and sheepdogs now some people prefer to believe that evil doesnt exist in the world those are the sheep and then you got predators who use violence to prey on the weak theyre the wolves and then there are those who have been blessed with the gift of aggression and the overpowering need to protect the flock these men are the rare breed that live to confront the wolf they are the sheepdog about this quote the true evil would be the sheep wouldnt think about it is the world evil because some people commit evil or because there arent enough good people to stop them innocence is evil itself innocence allows evil to enter home what do you think about it,0.9675559651449649,1,0.75,0.75
254800,a lot of people have walked all over me in my life and i still remain a kind person i need to improve in other areas but this is something i am good at first there is this show on netflix named daredevil if you havent seen it its about a blind superhero with all of his other senses extremely heightened the character is also a catholic so he has a strict rule about not killing people this may seem like a standard superhero thing but its actually not the antagonist in the first and third is very smart and has most of law enforcement in his pocket or blackmailed in some way the hero is faced with the fact that nothing short of killing the villain will stop him at times he even wants to kill him even the villain taunts him with the fact that the only way to stop him will be to kill him in the end he doesnt though the last time they fight in the final episode the hero yells to the villain because you dont get to change who i am this resonated with me so hard because no matter what people do to me that is the one thing they never get to do they never get to change who i am that is one power they dont get over me if you let them do that they win keep that in mind when you become angry and feel bitter about being treated badly and let it be your strength to keep you kind second you always have to come first this doesnt mean being selfish you can still be a kind and selfless person and still put yourself first think of it like not going to somebodys home you dont know very well just because you dont want to expose yourself to danger doesnt mean you dont trust them it just means you have to protect yourself its like not loaning money you cant afford to lose to somebody it doesnt make you a bad person it just means you cant afford to lose that money people will take from you and abandon you in need this is a fact of life dont give too much of yourself you can be kind and generous while still protecting yourself from this happening to you be kind but be firm when you have to say no to somebody explain why if you need to if they dont accept this then they are probably the kind of person who would take advantage of your kindness anyways third realize that there are a lot of bitter people in the world who want a rise out of you because it makes them feel better for a brief moment do your best not to give that to them take a breath walk away if you have to one thing i even do at times is make fun of myself better than they can nothing takes away their power like being better at what they are trying to do your reaction is their power take it away from them and make it your armor being kind is a precious gift to the world you make the world around you better by being kind dont let others destroy that i promise in time it will be a blessing for you and others i hope this helps you,0.9656992705179814,1,0.53,0.7
332048,no it makes you a human no one on this earth has ever not done a bad thing its what you do after which is most important and what defines you we are not our past theres an amazing ted talk with someone who killed someone as a revenge killing now they spend their life trying to help others not make the same mistake can we say that person in their last hours today is a bad person we can say his past self was bad for his choice but if you take him for who he is today you could say he did more good than the majority of people in the world,0.9620875912501754,1,1.75,3.51
163413,this is such a good question without going into why i am bad and relative badness compared to others on those subject areas where i have become less destructive to others the only thing i do different is something like the start of the nice doctorly hippocratic oath i e first do no harm i try not to leave people who dont know how to protect themselves worse off for having met me i try not to be the rock that they smash into even though its their fault theres an expression for this problem i an tired of always waking up next to the dead girl only a metaphor yes yes so that means you let some potential trouble source work out its destiny with the next other lucky winner and not at your hands avoid losers is a similar thought process i guess,0.9604359814496276,1,0.69,1.38
391353,im not reading way too much into anything its effortless for me like breathing just because it seems like too much work to you doesnt mean its objectively hard yes they do have good intentions they just dont see that their good intentions fuck everything up i mean nobody is evil everyone is just doing their best trying to survive and yet people keep calling a lot of people evil i never said that theyre terrible people i just said that they really need to work on their mental health,0.9586992769121684,1,2.22,1.11
345549,not all people are bad not all people are good time for you to decide if you want to be like the worthless garbage or if you want to be that one percent that even tho they get shit on theyre still gonna smile and be nice and keep pushing forward theyre not gonna be sheep and follow in the bullshit worthless garbage people theyre going to lead the pack and and have integrity by getting shit on and min later still being nice to strangers or helping when possible needed,0.9556182749948133,1,2.2,1.1
484638,i agree you are correct so what you believe in and with your critical thinking you have come to the conclusion that whatever you see around you doesnt have a maker ever thought why thats the case we inherently have a moral reasoning to choose good so if theres good theres bad too where do you think good comes from every civilization has a supreme being they worshipped worship why do you think that is why do you think god is mocked every time and everywhere if he doesnt exist dont you think by now we would have known i agree with your reasoning but why has jesus christ been written about what would anyone gain about writing a fiction about a perfect person and then choose to be punished for standing by it,0.9549279615391056,1,2.24,0.75
88703,evil is rewarded with opportunity the good starve to death and die in the gutter accept evil and youll be hard working and successful its hard to hear but truthful its science proven right countless times greedy takes from selfless abusers take advantage of those with compassion strong beat weak etc etc want to be healthy and abundant follow sin want to be immortalized in history take many lives away countless historical examples the only true advice youll ever hear not some emo or depressed just been given mountains of evidence it would be easier to deny evolution then this i by no means endorse violence just be nasty in mind and sociopathic in your decisions youll be rich in no time remember violonce is illegal to get away with stuff use office beauracracy people will want to attack you network to be strong so other people work for you,0.9501652196525306,1,0.67,1.33
327719,youre not a bad person everyone has flaws and makes bad choices breakups can be really hard and teen heart breaks can suck the very fact that you care about being a good person is proof that you arent a bad person you havr enough self awareness to know what your values are and recognise your flaws your next step is to try your best to not act in a way thats against your values,0.946415807211779,1,1.33,4
486742,ive begun to question whether im a good person youre probably not a good person is someone who strives to be good to those around them its not about endlessly helping people out and stretching yourself as thin as humanly possible its about wanting enrich others peoples lives around you with laughter joy empathy etc most people dont fall into that definition most people are selfish its all about me me me and they get worse as they age you sound like that you can change but it will be a long and difficult process and thats if you want to be a good person maybe you dont in that case embrace being egoist just make sure thats what you actually want so that you can be happy at the end of the day,0.9454648481490571,1,5.22,0
251775,dude that has nothing to do with beign honest with yourself those are problems and insecurities people project around them to shield themself in believe they are better than others because they cant accept the simple fact that noone is responsible for shit they are in but themselfes it doesnt matter if you are good or bad person in your core once you accept yourself you can move ahead from those and strive to be better person for those you care,0.9440859177756034,1,1.23,2.47
216290,i talked to my evil part recently even though there is no efficient way to be evil in this time it wont forgive me and will come to haunt me i started making decisions like this shouldnt exist in kindergarten ranting that tv advertisement is evil and people who participate are traitors out of all my other actions i think this is the most clear indication no one hurt me back then just out of boredom i laid an evil ideology at years old already later in life i consciously rejected a smartphone just to argue over a computer more all these illusions meant for other people a waste in the age of information so if youre as bad as me the best you can do is fully analyslze and acknowledge it,0.9360176794435701,1,0,3.03
184819,what is better to be born good or to overcome your evil nature through great effort paarthunax you are human we are all flawed in different ways you are choosing to do good when your nature wants to be hurtful keep on the right path do your best to be kind and i believe in time those negative feelings may become less and less i think its commendable that you are choosing to do the right thing even when you may not want too some people do not have that will power,0.9333862884609596,1,2.17,1.09
231911,if you believe you are bad you cant break out what happens is people use this to manipulate you they say yea but you aint all that good or yea but look at your past remember when you walk away leave tell them to go get out of your face you dont need that understand that you are good,0.9289114535359724,1,3.39,1.69
258362,whats equal got to do with it evil is evil youre going to let yourself off the hook because someone else is doing something worse theres always someone doing something worse you have no control over them or their actions you can only control your actions so keep going to that office job helping evil doers fuck people over people who live in glass houses shouldnt throw stones,0.9286592644824891,1,0,0
432724,no not everyone is a good person but if you meet someone new and they are vastly different from you dont look at them with hatred think of everyone you know really closely and name one thing that they struggle with i bet you can and strangers probably too you dont know what they have been through and you probably wont the point im trying to make is that you dont need to understand people but what helps is accepting them for who they are of course as long as they dont do anything that would make you act otherwise,0.9265393900853426,1,1,1
316120,i dont think i would say that most people suck but its definitely true that most people have different values and priorities than i do i also believe that the people one is close with reinforce ones behavior for better or for worse so it is important to be a bit selective about who we spend our time with,0.918531216800628,1,0,0
362347,first decide which group of people will view you as the bad guy only people who disrespect you or your loved ones protagonist hero the people in your immediate vicinity community school a hole jock douchebag the general populace villain status second accept whatever consequences come with your role the road to becoming a hero is hard and doesnt get rewarded until you succeed without perseverance and a good filter for bs you will likely fail only allot your efforts to those people and things that bring you closer to becoming the hero you envision being the douchebag works for a limited time only while you do have the pick of the litter by oppressing your community you run the risk of the underdog hero uniting everyone against you if youre not careful you have to keep all of the dweebs in check constantly dont let pussy distract you from your oppression maintenance team up with other douchebags and delegate for higher chance of success you will have to drop most of your morals any proclivity toward being good will be seen as weakness by other wannabe villains who are looking for a chance to take your spot your lack of morality will not only hurt innocent people but also people close to you by association they will blame themselves for how you turned out and disassociate from you but you will have more pussy than you can imagine only drawback is the women you pick from will be extremely untrustworthy and may work for other wannabe villains adopt paranoia if necessary,0.911912610252575,1,1.15,1.15
296687,whenever i see a canned overgeneralised positivity like that i wonder if theres ever an evil person reading it imagine someone thinking about joining a gang but they have doubts if its the right thing or not then they stumble across an empty platitude like this and they think fuck yeah i should do it i am the best im gonna be a godzilla and make those people my bitches then they go on dealing drugs and killing people,0.9114724350338108,1,0,0
163446,you arent a bad person no bad person is concerned about if they are a bad person they just are one also what is bad selfish mean unhappy you cant be bad at being a person we are just water and flesh walking around making choices and filling up a story book selfish mean and unhappy are all bad qualities however i would consider them all very appropriate in many situations good on you for wanting to better yourself check in with yourself throughout the day and look back on your actions and ask if they resonate with you want to be when people tell you thinks about you listen to the small things you dont have to believe it they may not be true but mill over them and above all spend lots of time looking for the space and the gentleness thats you,0.9077036741386053,1,0.69,5.52
427509,this is the most esoteric bullshit post ive seen one you are talking about virtue ethics which doesnt recognize evil as an argument in virtue ethics there is a balance between virtues and vices neither are good or evil they just exists there is talk of someone who is virtuous has the potential to cause more harm than someone who endulges in vices they are measures just like in kantian ethics where every decision is measured to give out the most happiness there is no negative the opposite of happiness there is just happiness i guess your post seems deep but it isnt you just question begged your way through paragraphs of esoteric shit at the end of the day there is no such thing as true evil and using vices as a way to say that evil is necessary shows that you know nothing about ethics ps this seems like it was written by ai,0.9031826641568262,1,2.56,0.64
342588,evil people dont worry too much about being evil the fact that you are willing to acknowledge that your behaviour has been shitty shows that there is good in you get your kicks from something else hit the gym take up an instrument study more whatever you can to get a buzz from something that doesnt involve being nasty you can do it,0.9030403617222482,1,1.59,3.17
342585,your not evil lets get that straight an evil person doesnt have the capability to take accountability your young and learning we all make mistakes we are all imperfect you are deserving of love and happiness guilt is good in moderation but excess amounts will eat you alive dont let the past define you its done its over your safe,0.9022784579620883,1,5,1.67
247513,please hold on you cant be the worst person in earth if you can acknowledge that youve done something wrong bad people dont do that you are a good person go through your journey and know the only thing you have to do is learn from it youre not alone,0.9020077962074784,1,2,2
67850,im not a good person ive done some terrible things to good people but when someone comes along that gets to know you and starts to believe in you and gives you hope you start to forget i want to forget she lets me feel like a good person she sees the softy i am she makes me happy i found home in her,0.9019941185263376,1,7.81,1.56
140947,yeah i guess that statement does tip toe into a larger philosophical question and i think there is something behind the hardwired biology argument while i personally dont believe in a singular manifestation of god who imposes morality i do believe in spirituality and something closer to karma putting good energy out into the universe replicates or something that sounds pretty hippy dippy but i think we all have to wrestle with the why do we want to be good people question the simplest answer that has worked for me is that it makes me feel good,0.8994163369183527,1,3.09,1.03
