"",Document,Probability,Segment,emo_pos,emo_neg
439243,bro tbvh people are good as long as you dont know them deeply once you start a person knowing in a much deeper way youll realise that everyone is not good that is just how life is it is hard to differentiate people quickly but one tip watch out for people who for example initiate convo without wanting anything in return those can be somewhere good this was my personal advice peace out homie s,1.0,1,4,0
432734,i dont necessarily see the good in everyone but my default is kindness many say that people have to earn their respect i start with respect and then if people earn my disrespect so be it but i dont really do arguments if people are consistently toxic ill create some distance i dont follow sadhguru but i used to be into a lot of zen and read be here now by ram dass over and over and it helped sadhana is sadhana i dont buy into the spiritual side of it anymore but non attachment and being in the moment are potent tools for dealing with life and other people i no longer believe that everyone has good in them though ive seen too much,1.0,1,1.6,0.8
430255,i dont believe there are bad people there are only good and bad choices i think if you understand that first youll get the perspective you need to start moving forward then every time you make a bad choice youll see it as just that one bad choice instead of seeing it as confirmation that you are a bad person get a journal and write down your good choices each day try to beat the number each day any good choice counts do this for months and youll feel like a good person ive been seeing a therapist for years its great see a therapist,1.0,1,3.81,4.76
427748,can you point out where in his her post evil is being used as an argument to me it sounds like he she simply states that both virtues and vices exist and that living a life to him her is striking a balance between them nowhere calling either virtues or vices inherently good or bad but rather stating that it is the interpretation of the individual or the environment whatever we or our environment considers bad,1.0,1,1.32,3.95
426271,do you seriously believe that majority of people are good flawed yes but good at their heart most people are not inherently mean or bad we find in the world what we put out if you find only betrayal and pain consider what energy youre putting out am i lucky that i continually find good people around me no i find them because i allow them the grace to show it i understand feeling burned and anger is a powerfully addictive emotion ive been there but choosing to find the good in the world leads to actually finding it choosing to see the ugliness will only show you the worst of it,1.0,1,3.57,2.68
420934,dont feel bad for being a good person you gave them the benefit of the doubt and helped a person in need but i do want to say that your good nature will attract the wrong kind of people sometimes people that take advantage of kind people it sucks over time you will learn to trust your gut and be able to determine who is genuine and who is taking advantage dont stop being a good person but dont allow people to mistreat you either,1.0,1,3.53,1.18
420777,yes thats what i said being a good person doesnt exclude having boundaries and being firm in maintaining them it doesnt exclude fighting for what you want in life you can do all the things op described as being strong and be a good person except being cruel that is never necessary,1.0,1,3.85,1.92
257829,yeah thats fair appreciate the respect i think the thing that clashes with me is the fact that we deserve good i guess it comes from the idea that we are good and perfect i dont really think anyone is naturally good everyone has done bad stuff so how can they be good if i am not good then why should i expect good things to happen i guess the definition of good seems shaky to me too it seems a lofty goal to achieve wealth happiness and relationships what happens when those dont happen am i just bound to be sad forever,1.0,1,8.74,1.94
504747,the concept of good and bad is an interesting one you can do good or bad things but that doesnt need to define you as a person if youve been doing things that you consider bad and you dont want to do those things anymore make a list of things you consider good and start doing them i imagine you will then begin to feel like a good person,1.0,1,5.8,4.35
249961,there are lots of good genuine people in the world the kind worth time and effort your right pleasing man is not the way humans have a tendency to change as the wind blows just look at whats happening in our culture right now last week one thing was ok and now its taboo i suggest digging deep planting roots in the rock and see what happens with all the windy people in the world we all need deeply grounded roots to withstand the storms of life be blessed be well,1.0,1,2.2,0
211211,being a good person should first and foremost be to feel good yourself youre all the better for it you shouldnt be anything for an abstract other not saying you shouldnt change yourself for your loved ones but building yourself so that people like you isnt going to be a very satisfying endevaour,1.0,1,5.66,0
204974,being a good person so that others see you being good is a sham its not genuine and people can tell be a good person if you want to be good be good for goodness sake if you are worried about what being good will get you then you are doing it for the wrong reasons and will get the wrong results,1.0,1,9.68,1.61
204466,number is important you arent good or bad and it certainly isnt determined by what you do you are a combination of a human who does good things and does bad things but dont extend that to yourself as thats toxic its a shift in perspective so easily we want to think after doing a bunch of good things wow i really did do all those good things i suppose i am a good person after all that thinking is toxic and later it can apply to the bad wow i really did all those bad things i suppose i am a bad person after all a better perspective is this wow i really do both good and bad things but i am a person neither good nor bad i am fulfilling my part as a human by being alive and human i hope this helps anyone,1.0,1,5.44,4.76
201863,i started watching the show the good place half a year ago its really funny and casual but it had a weird impact on me it made me question if i was a good person ive always seen myself as good but now ive realized that was just arrogant and naive the last couple of months i have been studying moral philosophy and stuff like it and i can honestly say i have improved but i have also started realizing i am never going to be able to see myself as a good person but that doesnt matter its the honest trying that counts i think i dont really know but i hope so ive changed how i view life in such a short time i feel like i dont really know the guy i was six months ago he wasnt worse per se he just didnt see himself for what he was an idiot in a world of other idiots,1.0,1,3.73,0
192113,i believe that people are not inherently good but you can bring out good and positive behaviors by connecting with other people and reinforcing theirs with your own good vibes but you have to make the choice to extend the olive branch and you will have to keep on doing it many times as most people will keep rejecting it it can and will bruise your ego and pride over rejections so its just an internal decision you have to make and its not an easy one that never stops being hard,1.0,1,4.35,0
45753,if you look for the bad youll see it theres plenty of injustice pain and suffering if you look for the good youll see it theres plenty of love kindness and generosity what you look for is what youll see look for the good at times youll need to create it youve got this,1.0,1,5.56,5.56
184836,at the end its not about what you feel like youre doing or not doing in this case its about what you are doing so even though you feel this way actively choosing to be a good person whether you believe it or not makes you a good person even if it doesnt feel genuine truly evil people wouldnt even fake being nice they just hurt and hurt and hurt others but i guess you choosing to be a good person says something good about you well anyways at the end of the day its great that you dont choose to go to the evil person route,1.0,1,3.74,2.8
184830,choosing to do be good and controlling and not unimportant identifying your bad side makes a good person in my book its so much better than people who act and feel like they can do no wrong the part of you that is actively trying to do the right thing even though you have negative urges makes you better and whole not less and broken,1.0,1,3.08,1.54
184824,i agree with everything you said and its all good advice with the caveat that not all people are mostly good in fact there is a lot of evil in the world and people with malevolent intentions who either commit horrendous acts or are simply too cowardly to do so this should not give one a pessimistic outlook on life and humanity but being willingly naive is dangerous and can lead to traumatic experiences that being said most people are primarily good and decent people in my experience op good for you for realising the self defeating nature of holding an incel outlook and taking the first steps toward fulfilling some of your inherent potential,1.0,1,3.48,2.61
184817,why do you think people do bad things its partly because being bad is so easy yet being good to others is hard thats because not only do you require proper effort to do actual good things but to also stand by your good actions when someone is shit to you dont think too hard about how you feel feelings are usually just hormones making you feel a random way if you keep feeling that way however try meditating and figuring out why you keep feeling this way it might be something youve done in the past for example and it still makes you feel like youre a bad person,1.0,1,2.73,2.73
178331,depends on your personal definition of good good can be honest hardworking fair loyal trustworthy nice helpful etc as long as you are comfortable with the people you surround yourself with and you notice no toxic traits in the people around you you are good to go i have heard the you are the product of your closes friends phrase a lot if you meant this particular phrase surrend yourself with people you want to be like if you want to achieve academic succes surround yourself with people with good grades if you want to achieve succes in sports surround yourself with athletes etc,1.0,1,4.81,0
175709,youre not a bad person youre just a person humans make mistakes and thats just how we learn youve clearly learned from your mistakes and thats what you need to focus on focus on the fact that youve learned and you wont do something like that again use this experience to be the kind of person you want to be and the kind of person i can tell you are im rooting for you,1.0,1,0,1.35
173510,i dont believe anyone is inherently evil if you consider yourself bad you should wonder about the question if this could have to do with your perspective talk to your friends and family about doing good and bad and how they see you good and bad are concepts which we made up doing things commonly described as good tend to be helpful to yourself and others if doing bad things make you feel good maybe they are good to you good luck finding out what it all means to you,1.0,1,6.67,4.44
156357,jp said something to this effect being a good person is having a sword but keeping it sheathed we all have flaws and moreover have the capacity to comit acts of great evil a good person knows and understands this but chooses to not act in such ways just a thought that resonated with me on this topic,1.0,1,3.45,0
61392,the good boy who is born without good principles is liable to become a bad man just as the bad boy who is born without bad principles is liable to become a good man in short you only define your path when you define your principles as they are what sustain who you are,1.0,1,5.56,5.56
68812,so much evil in the world is being exposed and fought constantly it is difficult because we are fighting an unknown people compromised and corrupt are most probably in on it and all their evil plans are rolling out hopefully few have been prevented and contained but there seems to be more we are overwhelmed open your eyes wider dig deeper break free from your distractions and illusions it is a probability invasion and or world domination help sos,1.0,1,1.27,1.27
130238,morality is recognizing that you are capable of malevolence and not doing it if you say you could never ever do something bad then you can get hurt by those that can and you dont know real morality if you are as harmless as a teddy bear how can you know the difference between good and bad dont beat yourself up man the past is the past let it go and make sure you are a good person now and now that you know whats good and bad you can choose to do good,1.0,1,4.26,5.32
125589,i think youre overanalyzing it a bit its not as easy to fall into the good person trap as it seems dont shout your good deeds from the rooftops but dont actively avoid doing the right or good thing because you think it may come off as snobbish conragtulations you are now being a decent person without being a dick about it dont think of yourself as a good person but a human whose prone to faults like everyone who tries to do the right thing dont do things as a good person do things as a person,1.0,1,5.1,0
125572,you think youre a good guy because you would hypothetically throw your life away to save an endangered species do you actually do anything to help endangered species or any animals or anyone youre totally delusional what good do you actually do dont tell yourself youre a good person if youre not be honest with yourself you have to admit you have a problem before you can change,1.0,1,4.41,0
117379,ive run into that in my life as well the issue is that i have a rule somewhere in my subconscious that basically states if i do something good i deserve to feel good and be rewarded for it which ideally id replace with doing good is its own reward imagine an exemplary figure watching you throughout the day someone whos a living saint or has the character traits you aspire to similarly winnow your thoughts and keep an eye on the value judgments youre making im such a good person i deserve to have some extra fries examine this thought is it correct or is an alternative thought like im such a good person getting a diet coke im the type of person who would order a salad as a side too a more useful one what makes a person good is whats inside them not what symbols they have look at marketing as providing things that are outside of your control and are nothing to you or avoid it in total,1.0,1,3.47,0
115458,no youre just a young woman you think youre good because you start with a natural advantage i thought you were bad based on the assumption that you were a young male if youre a young woman and people are still catching on to you youre really bad if youre actually good you wouldnt be using it to get drinks and better tips you wouldnt be a waitress in the first place if you were good you wouldnt have phrased anything in your first post the way you have everything you wrote puts people off of wanting to help you trust me on this one draw a circle and dont fuck with the people in that circle you wont be young and pretty forever,1.0,1,2.42,1.61
111640,good attitude in the long run i think you just need to establish your own definition of a good person and start using that as your measuring stick everyone has a different idea of what that looks like many of which directly contradict one another you physically cannot please everyone at the same time behaviour that inspires love and awe in some will inspire hate and condemnation from others and vice versa the point is that its okay to be the bad guy some times as long as you approach life with conviction youll have an easier time accepting any collateral social damage,1.0,1,5.83,1.94
98664,so its a matter of definition again because i think that no person is bad which has a single good thing in his her personality yes of course you can call this terribly naive again but for me its just a mentality which is helping me to not hate people and to react moderate to their actions so no hitler wasnt a bad person yes i wouldve hated him when do you think are people bad im awaiting your downvotes with raised head,1.0,1,1.2,7.23
98662,your statement wasnt no person is born bad your statement was there are no bad people in this world his life circumstances or not he was a bad person it doesnt matter what morphed him into one he was bad and a blanket statement saying no person is bad is simply false and ignorantly naive,1.0,1,0,9.09
206551,having good intentions or as i call it pure intentions separates you from the unaware you are a beautiful person for the way you live your life your life compared to most is magnificent and you have what most people are in fear of attaining the awareness of living in the present moment with pure intentions that is what life is all about,1.0,1,1.59,1.59
92093,there are three types of people in this world sheep wolves and sheepdogs question there are three types of people in this world sheep wolves and sheepdogs now some people prefer to believe that evil doesnt exist in the world those are the sheep and then you got predators who use violence to prey on the weak theyre the wolves and then there are those who have been blessed with the gift of aggression and the overpowering need to protect the flock these men are the rare breed that live to confront the wolf they are the sheepdog about this quote the true evil would be the sheep wouldnt think about it is the world evil because some people commit evil or because there arent enough good people to stop them innocence is evil itself innocence allows evil to enter home for example if i threaten to punch you but i dont have two arms you wont feel threatened and it will be pure innocence of me to think i could punch you and then seconds later i backtrack and decide im not going to punch you would that be an act of good obviously not because i was never able to punch you that is i was never capable of committing evil in the first place so to be good you need to be able to commit evil and then choose to do good so innocence that is the lack of knowledge would not be goodness it would be true evil as it allows evil in the world and worse you tend to be prone to falling into the hands of those of knowledge who have chosen to do evil what do you think of this,1.0,1,1.39,0.35
248235,a good person acts solely from unconditional love only with intent to benefit the collective even if this requires a sacrifice or setting aside personal desire a bad person will seek after their insatiable desires regardless of the harm or consequence it may cause for others and some may even take pleasure if it does most of us fall somewhere in between,1.0,1,4.84,1.61
219727,thats not really true though you are not your actions you are your beliefs so if you do bad things and you believe that its justified then youre a bad person but if you did something bad in the past and now you believe that its wrong it means that youve changed and become a better person,1.0,1,0,5.26
39102,im a highschool student and in one of my english assignments i was chosen to answer any question that technically has no right answer this was the question that came to mind i was told to use some sort of outside source where i directly ask people about my question so i decided what better way than reddit obviously there is no real line between a good person and a bad person since both good and bad are terms that were literally created by society im curious what you think defines a good person one scenario i thought of was for instance if someone were to commit a tragic crime obviously its fair that they suffer the consequences however does that automatically make them a bad person without questioning their morals their thought process would you label them as a bad person is that person wrong for believing in what he thought was right or justified ill be thankful for any and all responses,1.0,1,2.44,3.66
243527,thank you for your response i appreciate your honesty and do want to clarify one thing i dont think i am enlightened because i still fall short however i have seen the good things promised nothing more i choose to care about people because i have been cared for the only difference is where i met the people who did the caring and still does the caring even now,1.0,1,2.9,0
248239,a thieve is a bad person but a person who steels food for his children is not a bad person when the action doesnt define what is good or bad then it has to be the reason for the action hitler wanted to do good and clean the humans race but he was a bad person so its not the reason for the action that defines if you are good or bad you cant judge yourself as good or bad because your viewpoint can be wrong if the majority of people agree with your actions and your reasons you are a good person,1.0,1,4.85,5.83
45379,why be a good person its an interesting question at first glance the answer seems clear cut most of us want to be good because its part of what makes us who we are its almost like we were born with a mechanism that guides us morally some call that our soul some call that the orienting reflex some call that our conscience being good seems not only to be the right decision but also the most intelligent decision if we want to survive and thrive in a society then being a manipulating piece of garbage wont get us very far well have problems with the police well have problems with the law well have problems with the other members of our society one of the most primal instincts that we have as humans is the desire for belongingness and love theres a reason that abraham maslow has this desire as part of his hierarchy of needs how can one belong in a society and be loved by the people around them if they are not good being good is also helpful in business for those of us who live in the west capitalism and entrepreneurship are some of the values that our society holds dear the way entrepreneurship works is rather simple solve problems create solutions and provide value all of these components of entrepreneurship are in nature good of course not everyone who is successful in business is good there are a lot of shady and bad businesspeople with that being said providing value is at the crux of what makes someone a good entrepreneur we see already that being a good person feels good is helpful when it comes to business is helpful when it comes to people and is helpful when it comes to our overall health its almost like being good is both selfish and selfless heres a metaphor that has played an important role in my thinking your character and your integrity are like a glass of water the water is clean clear pure and transparent what happens if a drop of poison or a drop of blood falls into the glass one drop contaminates the entire water its for that reason that a small lie or a small bad deed is not always so small doing things that are wrong even if they may appear not to be a big deal slowly contaminate your entire character and your entire body of work i believe it was jordan peterson who first introduced me to this idea living a life of lying cheating and other bad deeds will eventually catch up to you everything comes out one day some like to call it karma some like to call it the legal system some like to call it heaven and hell i like to view it like this if were bad then were not only hurting the people around us but were also hurting ourselves where is the meaning in that it goes against every instinct that we have abraham maslow has self actualization at the top of his pyramid of needs how can one ever reach anything close to that if we are constantly doing things that are wrong its not possible heres a quote from philosopher and write fyodor dostoevsky that ive always liked above all dont lie to yourself the man who lies to himself and listens to his own lie comes to a point that he cannot distinguish the truth within him or around him and so loses all respect for himself and for others and having no respect he ceases to love i believe this quote can be applied not only to lying but also to all other types of wrong deeds final thoughts being good is not easy there have been a lot of wars and suffering throughout history humans are quite malleable a bad childhood or bad genetics can lead people to become monsters there is a lot of evil in the world with that being said i believe humans are capable of a lot good being a moral and ethical person being good being kind and helping others will not only make the world a more beautiful place but it will also be good for ourselves it feels good its a meaningful process and it leads to continual self improvement why dirty your soul why dirty that clear water embrace goodness and allow it to make you a better person lets be good lets be helpful lets be kind lets be understanding lets improve ourselves lets improve our communities lets improve our world meaning is always more important than short term detrimental pleasure lets not allow drops of poison or blood to mess with our clear water,1.0,1,2.66,1.14
44550,i wouldnt consider myself evil but i would consider myself a bad person sometimes is said im now bad that those or these are bad but im still a bad man theyre just worse im going to be in some months and i still doing bad i try to do good but i return to evil sometimes i feel i am the bad guy the evil man i try to be good but i remember this bad things and i dont feel good i just want to know how to be a good man i just want to be it help me,1.0,1,3.92,6.86
